datetime,text,username
2022-07-21 09:47:17+00:00,"@dottorbarbieri Il nano malefico andasse a zappare, visto che con i tamponi voleva rendere lo stress agli italiani ,gli umani eh Brunetta immagina se hai davanti Dio 👁",ElKrish3
2022-07-21 09:47:16+00:00,"@MattOneMouse Precisiamo che è un orchetto , meglio noto come Goblin in altre dimensioni fantasy, e non un nano.",r64479688
2022-07-21 09:47:14+00:00,Il nano e la inutile Gelmini lasciano forza Italia. Nascondere di essere piddini non era più fattibile...,blanchewitch17
2022-07-21 09:46:42+00:00,"@dottorbarbieri Ciao, non ci mancherai nano malefico.",ezeta67
2022-07-21 09:46:26+00:00,@dottorbarbieri Che lasci anche la vita terrena il nano di merda del demonio.,unfruitfruitful
