datetime,text,username
2022-07-21 07:58:02+00:00,"Cazzate, cazzate, cazzate.
A Firenze ho conosciuto un nano della stirpe di Durin, peloso come un licantropo, capace di far perdere la testa a qualunque ragazza incontrasse. Letteralmente.
Nel villaggio dove ho fatto l'animatore, il più brutto dei miei colleghi è stato con una VIP https://t.co/pEbxVPi92s",geppodanese
2022-07-21 07:56:51+00:00,"Addio al governo #MarioDraghi Così centrodestra e Movimento 5 Stelle hanno deciso la fine. Oggi il premier al Colle, elezioni a breve https://t.co/DGRFnFvPNS ricordiamo i filo putì “nano” quando andremo a votare ma spero anche se ne ricordino quelli che volevano il campo largo",annabelladellac
2022-07-21 07:53:50+00:00,"@ilPellicano_ No, la tua fama è terminata con franco da legnano ora è il tempo di figa nana",Scimmiapelatina
2022-07-21 07:53:50+00:00,"@ilPellicano_ No, la tua fama è terminata con franco da legnano ora è il tempo di figa nana",Scimmiapelatina
2022-07-21 07:50:29+00:00,"@ilmora61 @GiusePat @felice_nano @LaBombetta76 Il problema non è avere dubbi: questo è, non solo legittimo, ma addirittura auspicabile.
Il problema, se permette, è perseverare nello spargere teorie infondate (ed onestamente insostenibili) nonostante la mole enorme di dati sperimentali che contraddicolo le sue affermazioni.",ilconte_dantes
2022-07-21 07:50:19+00:00,Parte degli Italiani lo pensavano un gigante invece era un nano ! #21luglio,ganga2410
